{
  "schema_version": 1,
  "name": "official-doc-cn-12pt",
  "description": "Chinese official document preset with an 18 pt title and 12 pt headings and body",
  "extends": "official-doc-cn",
  "paragraph_defaults": {
    "line": 400
  },
  "list_settings": {
    "first_line_indent": 480
  },
  "styles": {
    "title": {
      "size_half_points": 36,
      "spacing_after": 400
    },
    "heading1": {
      "size_half_points": 24,
      "first_line_indent": 480
    },
    "heading2": {
      "size_half_points": 24,
      "first_line_indent": 480
    },
    "heading3": {
      "first_line_indent": 480,
      "size_half_points": 24
    },
    "body": {
      "size_half_points": 24,
      "first_line_indent": 480
    },
    "figure_caption": {
      "size_half_points": 24
    },
    "figure_legend": {
      "size_half_points": 24
    }
  }
}
